8410500028824	es					Postre de chocolate														Danone	danone	Postres	en:desserts			España	en:spain			0																							100g	100g			123	kcal	3.3	g	2	g	19.5	g	17.4	g			3	g	0.16	g	0.064	g			123	kcal																																											unknown	c	4	unknown		1		-5	-15	1	0	App - Yuka, Apps
8410500010621	es					Natillas de chocolate sin gluten		Danet Chocolate								500 g e(4 x 125 g)	125g	en:Bote, en:Fresco, en:Plástico	en:bote,en:fresco,en:plastico	Danone	danone	Lácteos, Postres, Postres lácteos, Postres de chocolate, Postres de cremas, Natillas chocolate, en:Refrigerated creamy puddings, en:Refrigerated chocolate creamy puddings	en:dairies,en:desserts,en:dairy-desserts,en:chocolate-desserts,en:creamy-puddings,en:chocolate-creamy-puddings,en:refrigerated-creamy-puddings,en:refrigerated-chocolate-creamy-puddings	en:Sin gluten	en:sin-gluten	España, en:Francia	en:spain,en:francia			0																		Leche, Nato, Sólidoslácteos	en:milk,es:nato,es:solidoslacteos				100g	100g			121	kcal	3	g	1.8	g	19.9	g	17.5	g			3.2	g	0.13	g	0.052	g			121	kcal																									2.2	g		en:pot	en:plastic											en:dairy-desserts	en:milk-and-dairy-products,en:dairy-desserts		unknown	c	4	b	68		39200	-5	-10	1	0	App - yuka, Apps, App - smoothie-openfoodfacts
9339687104734	en				Milk chocolate peanuts											68g				Danone	danone	Snacks, Sweet snacks, Cocoa and its products, Confectioneries, Bars, Chocolate candies, Bars covered with chocolate	en:snacks,en:sweet-snacks,en:cocoa-and-its-products,en:confectioneries,en:bars,en:chocolate-candies,en:bars-covered-with-chocolate	Health Star Rating 0.5	en:health-star-rating-0-5	Australia	en:australia	Woolworths	woolworths	0																							100g	100g			536	kcal	31.2	g	13.2	g	54.4	g	46.8	g	15.7353	g	10.4	g	0.16	g	0.064	g			536	kcal																																								en:biscuits-and-cakes	en:sugary-snacks,en:biscuits-and-cakes		unknown	e	21	unknown		1		-5	-15	1	0	App - yuka, Apps, App - smoothie-openfoodfacts
5601050030129	pt														Iogurte Líquido com Raspas de Chocolate	4				Danone,DanUp	danone,danup	Bebidas, Laticínios, Alimentos Fermentados, Sobremesas, Produtos lácteos fermentados, Sobremesas de laticínios, Bebidas lácteas, en:Fermented dairy desserts, Bebidas fermentadas, Bebidas lácteas fermentadas, Iogurtes, Iogurtes líquidos	en:beverages,en:dairies,en:fermented-foods,en:desserts,en:fermented-milk-products,en:dairy-desserts,en:dairy-drinks,en:fermented-dairy-desserts,en:fermented-drinks,en:fermented-milk-drinks,en:yogurts,en:drinkable-yogurts			Portugal	en:portugal			0																	Leite pasteunzado, do e num modo de sore de lactose concentrada reconstituido, açúcar, raspas de chocolate (0,8%) (manteiga de cacau, cacau em pó, manteiga concentrada de cacau em pó magro e açúcar), xarope de glucose frutose, aroma de baunilha, fermentos lácticos activos e conservante (E202).						100g	100g					3.6	g	2.5	g	14.7	g	14.5	g	0.1	g	1.8	g	0.1	g	0.04	g																																												en:sweetened-beverages	en:beverages,en:sweetened-beverages	4	en:4-ultra-processed-food-and-drink-products			e	17	1	19508	-5	-15	1	0	
5601050036602	pt					griego				Iogurte grego stracciatella						440 g	110			Danone,Oikos	danone,oikos	Laticínios, Alimentos Fermentados, Sobremesas, Produtos lácteos fermentados, Sobremesas de laticínios, en:Fermented dairy desserts, Iogurtes, en:Chocolate chunks yogurts, Iogurtes gregos	en:dairies,en:fermented-foods,en:desserts,en:fermented-milk-products,en:dairy-desserts,en:fermented-dairy-desserts,en:yogurts,en:chocolate-chunks-yogurts,en:greek-style-yogurts			Espanha	en:spain			0							ES 15.00783/B EC	es-15-00783-b-ec									Leite pasteurizado, nata pasteurizada, açúcar, raspas de chocolate (2%) [pasta de cacau, manteiga de cacau e açúcar], leite desnatado em pó, aroma e fermentos láticos. Pode conter vestígios de cereais com glúten, frutos de casca rija e ovo.	Leite	en:milk	Ovos, Nozes	en:eggs,en:nuts		100g	100g	717	kJ			10	g	6.3	g	17.5	g	17.2	g			2.9	g	0.1	g	0.04	g			717	kJ																																								en:milk-and-yogurt	en:milk-and-dairy-products,en:milk-and-yogurt	4	en:4-ultra-processed-food-and-drink-products	d	11	c	43	1	19580	-5	-15	1	0	App - Yuka, Apps, App - Open Food Facts
3033491871610	fr							Danette fondant chocolat saveur noisette												Danone,Danette	danone,danette	Produits laitiers, Desserts, Desserts lactés, Desserts au chocolat, Crèmes dessert, Crèmes dessert chocolat, Crèmes dessert rayon frais, Crèmes dessert chocolat réfrigérées	en:dairies,en:desserts,en:dairy-desserts,en:chocolate-desserts,en:creamy-puddings,en:chocolate-creamy-puddings,en:refrigerated-creamy-puddings,en:refrigerated-chocolate-creamy-puddings	Triman	fr:triman	France	en:france			0							FR 14.370.001 EC	fr-14-370-001-ec						Lait entier (82,5%), sucre, cacao maigre, chocolat liquide (2%) (sucre, pâte de cacao, cacao maigre, émulsifiant (lécithine de soja), arôme), crème (lait), stabilisant (pectine de fruit), amidon de maïs, épaississant (amidon transformé de maïs), arôme. Lait:Origine France. Contient: lait, soja.				Lait, Soja	en:milk,en:soybeans				100g	100g			117	kcal	4	g	2.7	g	16.9	g	15.6	g	0.85	g	3.3	g	0.13	g	0.052	g			117	kcal																																								en:dairy-desserts	en:milk-and-dairy-products,en:dairy-desserts	4	en:4-ultra-processed-food-and-drink-products	c	4	b	63	1	39200	-5	-15	1	0	App - Yuka, Apps, App - smoothie-openfoodfacts
3033491834103	fr							"Mousse chocolat à base de lait de coco"												Danone,Danette	danone,danette	Desserts, Desserts au chocolat, Mousses au chocolat végétaliennes	en:desserts,en:chocolate-desserts,en:vegan-chocolate-mousses	Nutriscore, Nutriscore C	en:nutriscore,en:nutriscore-grade-c	France	en:france			0														"Lait de coco (60%) (eau, crème de coco), eau, chocolat en poudre (10,9%) (sucre, cacao en poudre), fibre soluble de maïs, sucre (4,1%), protéines de pois, chocolat noir en poudre (1%) (poudre de cacao, pâte de cacao, sucre), épaississants (amidon transformé de tapioca, agar agar), émulsifiants (mono-diglycérides d'acides gras), sel. Peut contenir: traces de lait, soja, fruits à coque et céréales contenant du gluten."						"Gluten, Lait, Fruits à coque, Soja"	en:gluten,en:milk,en:nuts,en:soybeans		100g	100g			152	kcal	8	g	7.1	g	14.5	g	12	g	6	g	2.7	g	0.22	g	0.088	g			152	kcal																																										4	en:4-ultra-processed-food-and-drink-products	c	3	unknown		1		-5	-15	1	0	App - Yuka, Apps
3033490595401	en				Danette Mousse Liégeoise Chocolat			Danette Mousse Liégeoise Chocolat				Dessert lacté au chocolat		Dessert lacté au chocolat		640 g (8 * 80 g)	Un pot (80 g)	Plastic, Pot, Container, Fresh	en:plastic,en:pot,en:container,en:fresh	Danone, Danette	danone,danette	Dairies, Desserts, Dairy desserts, Chocolate desserts, Creamy puddings, Sweet mousses, Chocolate mousses, Dairy Mousses	en:dairies,en:desserts,en:dairy-desserts,en:chocolate-desserts,en:creamy-puddings,en:sweet-mousses,en:chocolate-mousses,en:dairy-mousses	Green Dot, Nutriscore, Nutriscore Grade D	en:green-dot,en:nutriscore,en:nutriscore-grade-d	France, Switzerland	en:france,en:switzerland	Carrefour,Magasins U,carrefour.fr	carrefour,magasins-u,carrefour-fr	0					France	france	DE BY-601 EC	de-by-601-ec			_Lait_ entier, _crème_, _lactose_, sirop de glucose-fructose, sucre, chocolat (4,8%) (pâte de cacao, sucre, émulsifiant : lécithine de _soja_, arôme naturel de vanille), cacao maigre en poudre, émulsifiant (esters lactiques des mono - et diglycérides d'acides gras), épaississants (amidon transformé, carraghénanes, gomme xanthane), gélatine, arôme, sel,			_Lait_ entier, _crème_, _lactose_, sirop de glucose-fructose, sucre, chocolat (4,8%) (pâte de cacao, sucre, émulsifiant : lécithine de _soja_, arôme naturel de vanille), cacao maigre en poudre, émulsifiant (esters lactiques des mono - et diglycérides d'acides gras), épaississants (amidon transformé, carraghénanes, gomme xanthane), gélatine, arôme, sel,				Milk, Soybeans, Lait, Crème	en:milk,en:soybeans,en:lait,en:creme	Nuts, Peanuts	en:nuts,en:peanuts	off	100g	100g			194	kcal	9.7	g	6.5	g	22.6	g	21.3	g	1.2	g	3.4	g	0.2	g	0.08	g			194	kcal																												en:container	en:plastic			en:pot							https://danette.fr.dan-on.com/danette-mousse-liegeoise/chocolat	en:dairy-desserts	en:milk-and-dairy-products,en:dairy-desserts	4	en:4-ultra-processed-food-and-drink-products	d	11	d	22		39206	-5	-15	1	0	App - yuka, Apps, App - InFood, App - Open Food Facts
8410500025830	es					Natillas Navidad choco avellana														danone	danone	Lácteos, Postres, Postres lácteos, Postres de chocolate, Postres de cremas, Postres lácteos con chocolate	en:dairies,en:desserts,en:dairy-desserts,en:chocolate-desserts,en:creamy-puddings,en:dairy-chocolate-desserts			España	en:spain			0							FR 38.408.002 EC	fr-38-408-002-ec			pasteurized milk, sugar, degreased cocoa, pasteurized cream, chocolate (2%) (sugar, poop paste, degreased cocoa, emulsifier (soy lecithin) and flavouring], dairy solids, modified corn starch and starch, thickener (carrageenans) and hazelnut flavour, may contain almond, hazelnut and walnut,	Leche pasteurizada, azúcar, cacao desgrasado, nata pasteurizada, chocolate (2%) (azúcar, pasta de caca0, cacao desgrasado, emulgente (lecitina de soja) y aroma], sólidos lácteos, almidón y almidón modificado de maíz, espesante (carragenanos) y aroma a avellana, Puede contener almendra, avellana y nuez,						Leche, Soja	en:milk,en:soybeans	Frutos de cáscara	en:nuts		100g	100g			134	kcal	4.2	g	2.8	g	20.3	g	18.2	g			3.3	g	0.11	g	0.044	g			134	kcal																																								en:dairy-desserts	en:milk-and-dairy-products,en:dairy-desserts	4	en:4-ultra-processed-food-and-drink-products	c	5	unknown		1		-5	-15	1	0	App - yuka, Apps, App - InFood
8595002109575	cs		"Kostíci kapsička ČOKO"													130g	130g	"Umělá hmota"	en:plastic	Danone	danone	"Mléčné výrobky, en:Fermented foods, en:Desserts, en:Fermented milk products, en:Dairy desserts, en:Fermented dairy desserts, Jogurt, en:Chocolate chunks yogurts"	en:dairies,en:fermented-foods,en:desserts,en:fermented-milk-products,en:dairy-desserts,en:fermented-dairy-desserts,en:yogurts,en:chocolate-chunks-yogurts	Vegetariánské	en:vegetarian	"Česko"	en:czech-republic			0		en:Milk from Czechia	en:milk-from-czechia																				100g	100g	464	kJ	110	kcal	3.1	g	1.9	g	14.5	g	14.1	g	0	g	5.8	g	0.08	g	0.032	g			464	kJ																													en:plastic											en:milk-and-yogurt	en:milk-and-dairy-products,en:milk-and-yogurt		unknown	b	2	c	48		19580	-5	-10	1	0	App - Open Food Facts, Apps
8410500028428	fr							con bolitas de Chocolate												Danone	danone			Nutriscore, Nutriscore C	en:nutriscore,en:nutriscore-grade-c	France	en:france			0																							100g	100g			143	kcal	4.2	g	2.7	g	22.9	g	19.2	g			3.5	g	0.2	g	0.08	g			143	kcal																																											unknown			unknown		1		-5	-15	1	0	App - Yuka, Apps
3033491377105	fr							Le Liégeois								10400 g	100g	4x100	fr:4x100	Danone	danone	Produits laitiers, Desserts, Desserts lactés, Desserts au chocolat, Desserts lactés au chocolat, Liégeois	en:dairies,en:desserts,en:dairy-desserts,en:chocolate-desserts,en:dairy-chocolate-desserts,en:liegeois			France	en:france	carrefour.fr	carrefour-fr	0														Lait entier, crème (lait), eau, sucre perméat de petit lait (lactosérum) en poudre, chocolat (2,0%) (Sucre, pâte de cacao, cacao maigre, émulsifiant (lécithine de soja), arôme), cacao maigre, épaississants (amidon transformé, carraghénanes), amidon, gélatine (non porcine), émulsifiant (esters lactiques des mono - et diglycérides d'acides gras), arôme (lait), sel.				Lait, Soja	en:milk,en:soybeans	"Œufs, Gluten, Lait, Fruits à coque"	en:eggs,en:gluten,en:milk,en:nuts		100g	100g			157	kcal	7.6	g	5.2	g	19	g	17	g			2.8	g	0.14	g	0.056	g			157	kcal																																								en:dairy-desserts	en:milk-and-dairy-products,en:dairy-desserts	4	en:4-ultra-processed-food-and-drink-products	c	8	c	53	1	19681	-5	-15	1	0	App - off, App - yuka, Apps
40145228	en				Monte Chocolate Pudding 55G (4PCS)												55.0g			Danone	danone					Germany	en:germany			0							DE BY-77721 EC	de-by-77721-ec															100g	100g			183	kcal	12.2	g	8.1	g	15.5	g	13.6	g	0	g	2.6	g	0.1	g	0.04	g			183	kcal																																											unknown			unknown		1		-5	-15	1	0	App - Yuka, Apps
9344962004180	en				Mint chocolate icecream															Danone	danone					Australia	en:australia			0																							100g	100g			126.74418604651	kcal	3.7209302325581	g	2.4418604651163	g	5.3488372093023	g	5.1162790697674	g			11.744186046512	g	0.29941860465117	g	0.119767441860468	g			126.74418604651	kcal																																											unknown			unknown		1		-5	-15	1	0	App - Yuka, Apps
5601050036732	es					Yogur griego Oikos con chocolate valor														Danone	danone					España	en:spain			0																							100g	100g			157	kcal	8.4	g	5.3	g	17.2	g	15.9	g			3	g	0.11	g	0.044	g			157	kcal																																											unknown			unknown		1		-5	-15	1	0	App - Yuka, Apps
75030896	es					Danette Chocolate Danone							Dulce a base de leche sabor chocolate			100 g	100 g	Plástico, Bote	en:plastic,en:pot	Danone	danone	Postres	en:desserts			México	en:mexico			0		México	en:mexico		irapuato,guanajuato	irapuato,guanajuato						Leche descremada pasteurizada y/o reconstituida pasteurizada de vaca, sólidos de leche, azúcar, crema, almidón modificado, cocoa, chocolate en polvo, colorantes (caramelo clase IV, carmín y clorofilina de sodio y cobre), picofosfato de sodio, citrato de sodio y carragenina. Contenido mínimo de leche de vaca 3,5%. Leyenda precautoria: Contiene soya.						Leche, Soja	en:milk,en:soybeans				100g	serving	554.6	kJ			3.7	g	2.3	g	22.4	g	18.9	g	0.8	g	2.2	g	272.796	mg	109.1184	mg			554.6	kJ																			84	mg								en:pot	en:plastic													4	en:4-ultra-processed-food-and-drink-products	c	7	unknown				-3	-10	1	0	App - smoothie-openfoodfacts, Apps
7506443101401	es					YoPro proteína vegetal chocolate plátano														Danone	danone	Bebidas, Lácteos, Comidas fermentadas, Postres, Productos fermentados de la leche, Postres lácteos, Bebida lácteas, en:Fermented dairy desserts, Bebidas fermentadas, Bebidas de leche fermentada, Yogures, Yogures para beber	en:beverages,en:dairies,en:fermented-foods,en:desserts,en:fermented-milk-products,en:dairy-desserts,en:dairy-drinks,en:fermented-dairy-desserts,en:fermented-drinks,en:fermented-milk-drinks,en:yogurts,en:drinkable-yogurts			España	en:spain			0																							100g	100g																																																																en:milk-and-yogurt	en:milk-and-dairy-products,en:milk-and-yogurt		unknown			e	17	1	19508	-5	-15	1	0	App - elcoco, Apps, App - El CoCo
7791337004627	es					Danette										95 g	95g	Plástico	en:plastic	Danone	danone	Lácteos, Postres, Postres lácteos, Postres de chocolate, Postres lácteos con chocolate	en:dairies,en:desserts,en:dairy-desserts,en:chocolate-desserts,en:dairy-chocolate-desserts	Sin gluten, Sin TACC	en:no-gluten,es:sin-tacc	Argentina	en:argentina	La anonima	la-anonima	0					Argentina	argentina						Leche entera, azúcar de caña, crema, cacao, almidón mosilicado de maíz, leche en polvo descremada, almidón, vitamina A, vitamina D, vitamina B9, colorante caramelo, estabilizantes (INS 456, INS 407), aroma.						Leche	en:milk	Leche, Frutos de cáscara, Nuez pecan	en:milk,en:nuts,es:nuez-pecan		100g	100g	572	kJ	137	kcal	4.21	g	2.53	g	21.1	g	0	g	0.84	g	3.68	g	45.5	mg	18.2	mg	0	% vol	572	kJ											234	&#181;g	1.47	g	54.7	g			102	&#181;g									en:plastic											en:dairy-desserts	en:milk-and-dairy-products,en:dairy-desserts	4	en:4-ultra-processed-food-and-drink-products	b	1	unknown				-5	-10	1	0	App - Open Food Facts, Apps
8410500019525	es					Doble placer natillas de chocolate con nata		Danette Double plaisir Chocolat et Crème						Danet Doble Placer Chocolate Con Nata		400 g (4 x 100 g)	100 g	Plástico, Bote, Fresco	en:plastic,en:pot,en:fresh	Danone	danone	Lácteos, Postres, Postres lácteos, Postres de chocolate, Postres de cremas, Natillas chocolate, en:Refrigerated creamy puddings, en:Refrigerated chocolate creamy puddings	en:dairies,en:desserts,en:dairy-desserts,en:chocolate-desserts,en:creamy-puddings,en:chocolate-creamy-puddings,en:refrigerated-creamy-puddings,en:refrigerated-chocolate-creamy-puddings	Punto Verde	en:green-dot	Francia, España	en:france,en:spain			0														_Lait_ pasteurisé (50,2 %), _crème_ pasteurisée, eau, sucre, minéraux du _lait_, chocolat (2,1 %) [sucre, cacao, poudre de cacaomaigre, émulsifiant (lécithine de _soja_) et de l'arôme], la graisse de cacao , l'amidon et l'amidon de maïs modifié, épaississant (carraghénane), gélatine, émulsifiant (E472b), arômes (contenant du _lait_) et sel.				Leche, Soja	en:milk,en:soybeans				100g	100g			157	kcal	7.6	g	5.2	g	19	g	17	g			2.8	g	0.14	g	0.056	g			157	kcal																												en:pot	en:plastic											en:dairy-desserts	en:milk-and-dairy-products,en:dairy-desserts		unknown	c	8	b	68		39200	-5	-10	1	0	App - yuka, Apps
4009700040152	de		"Čokoládový pudink s lískovým oříškem"	Haselnuss Dessert pflanzlich							Schoko-Pudding auf Haselnuss-Basis					375g		Metall, Kunststoff, Papier	en:metal,en:plastic,en:paper	Danone	danone	Pflanzliche Lebensmittel und Getränke, en:Dairy substitutes, Desserts, Milchfreie Nachtische, Puddings, Schokoladendesserts	en:plant-based-foods-and-beverages,en:dairy-substitutes,en:desserts,en:non-dairy-desserts,en:puddings,en:chocolate-desserts	Vegetarisch, Vegan, Europäische Vegetarier-Union, Europäische Vegetarier-Union Vegan, Nutriscore, Nutriscore C	en:vegetarian,en:vegan,en:european-vegetarian-union,en:european-vegetarian-union-vegan,en:nutriscore,en:nutriscore-grade-c	Schweiz, en:deutschland	en:switzerland,en:deutschland	Edeka	edeka	0					Germany	germany			"Pitná voda, 9,4% čokoládový prášek (cukr, kakao), cukr, 4,5% liskový oříšek, 0,8% hořká čokoláda, modifikovaný tapiokový škrob, zahušťovadlo agar-kgar, jedlá sůl."	Wasser, 9,4% Schokoladenpulver (Zucker, Kakao), Zucker, 4,5% Haselnüsse, 0,8% dunkle Schokolade, Modifizierte Stärke, Verdickungsmittel Agar-Agar, Salz								Milch, Schalenfrüchte, Soja	en:milk,en:nuts,en:soybeans				100g	100g	470	kJ	111	kcal	3.6	g	0.7	g	17.6	g	12.3	g			1.4	g	0.125	g	0.05	g			470	kJ																													en:plastic				en:paper				en:metal			en:dairy-desserts	en:milk-and-dairy-products,en:dairy-desserts	4	en:4-ultra-processed-food-and-drink-products	c	3	unknown				-5	-15	1	0	App - yuka, Apps, App - Open Food Facts
8696368906263	tr															330ml		Tetra Pak	en:tetra-pak	Danone	danone	"Atıştırmalıklar, en:Sweet snacks, Kakao ve kakao ürünleri, Çikolatalar, Sütlü çikolata"	en:snacks,en:sweet-snacks,en:cocoa-and-its-products,en:chocolates,en:milk-chocolates			Türkiye	en:turkey			0																						off	100g	100g																																																				en:brick	en:tetra-pak											en:chocolate-products	en:sugary-snacks,en:chocolate-products		unknown			d	29		31004	-5	-4	1	0	App - Open Food Facts, Apps
5601050030396	pt									DanUp Stracciadictive					Iogurte líquido com raspas de chocolate	149ml		Plástico, Garrafa, Garrafa de Plástico	en:plastic,en:bottle,pt:garrafa-de-plastico	Danone,DanUp	danone,danup	Iogurte líquido com raspas de chocolate, Straciatella	pt:iogurte-liquido-com-raspas-de-chocolate,pt:straciatella			Portugal	en:portugal	Pingo Doce	pingo-doce	0		Não especificado na embalagem	pt:nao-especificado-na-embalagem				PT ILT 40 EC	pt-ilt-40-ec									_Leite_ pasteurizado, soro de _lactose_ concentrada restituído, açúcar, raspas de chocolate (0,8%) (manteiga de cacau, cacau em pó, manteiga concentrada de cacau em pó magro e açúcar), xarope de glucose frutose, aroma de baunilha, fermentos lácticos activos e conservante (E202)	Leite	en:milk	Glúten, Nozes, Amêndoa, Frutos de casca riija	en:gluten,en:nuts,pt:amendoa,pt:frutos-de-casca-riija		100g	100g			120	kcal	3.6	g	2.5	g	14.7	g	14.5	g	0.1	g	1.8	g	0.254	g	0.1016	g			120	kcal																			85	mg								en:bottle	en:plastic										http://www.danone.pt/marcas/danup/			4	en:4-ultra-processed-food-and-drink-products	c	6	unknown				-5	-10	1	0	
3033491377006	fr							Danette								12*115 g		Plastique	en:plastic	Danone	danone	"Produits laitiers, Desserts, Desserts lactés, Desserts au chocolat, Crèmes dessert, Crèmes dessert chocolat, Crèmes dessert rayon frais, Desserts lactés au chocolat, Crèmes dessert chocolat réfrigérées, Desserts lactés à la vanille"	en:dairies,en:desserts,en:dairy-desserts,en:chocolate-desserts,en:creamy-puddings,en:chocolate-creamy-puddings,en:refrigerated-creamy-puddings,en:dairy-chocolate-desserts,en:refrigerated-chocolate-creamy-puddings,fr:desserts-lactes-a-la-vanille			France, Royaume-Uni	en:france,en:united-kingdom	SuperU, carrefour.fr	superu,carrefour-fr	0		France, Union européenne	en:france,en:european-union		France	france	FR 38.408.002 EC	fr-38-408-002-ec						"CHOCOLAT : LAIT entier et LAIT écrémé (80,1%) sucre chocolat (2,2%) ( sucre, pate de cacao, cacao maigre en poudre, émulsifiant : lécithine de SOJA, arôme) cacao maigre en poudre (SOJA) épaississants : E 1442 (amidon transformé), E 407 (carraghénanes) perméat de petit LAIT (lactosérum) en poudre amidon.
SAVEUR VANILLE : LAIT entier et LAIT écrémé concentré (86,2%) sucre épaississants: E 1442 (amidon transformé), E 407 (carraghénanes) perméat de petit LAIT (lactosérum) en poudre amidon crème (LAIT) arôme (LAIT) colorant : E 160a (bêta-carotène)
CARAMEL : LAIT entier et LAIT écrémé concentré (82,3%) sucre caramel 5,6% (sucre, sirop de glucose-fructose, eau) épaississants: amidon transformé(E1442), carraghénanes (E407) crème (LAIT) amidon stabilisant: phosphate dipotassique (E340) arôme (LAIT) sucre cuit sel"				Lait, Soja	en:milk,en:soybeans				100g	100g	453	kJ	107	kcal	3	g	2	g	17.1	g	14.4	g			3	g	0.12	g	0.048	g			453	kJ																											1	en:sleeve	en:plastic	en:recycle	12	en:pot		en:discard	12	en:seal		en:discard		en:dairy-desserts	en:milk-and-dairy-products,en:dairy-desserts	4	en:4-ultra-processed-food-and-drink-products	c	4	b	68		39200	0	-15	1	0	App - yuka, Apps
8410500011352	es					Postre de soja chocolate - DESCATALOGADO							Postre de soja con chocolate			400 g (4 x 100 g)		Refrigerado, Caja de cartón, Tarrina de plástico	en:refrigerated,es:caja-de-carton,es:tarrina-de-plastico	Danone	danone	Alimentos y bebidas de origen vegetal, Botanas, en:Dairy substitutes, Postres, Postres vegetales, Postres de chocolate, Postres de soja, en:Vegan creamy puddings, en:Flavoured soy dessert, en:Vegan chocolate puddings, Postres de soja con cacao	en:plant-based-foods-and-beverages,en:snacks,en:dairy-substitutes,en:desserts,en:non-dairy-desserts,en:chocolate-desserts,en:soy-desserts,en:vegan-creamy-puddings,en:flavoured-soy-dessert,en:vegan-chocolate-puddings,en:chocolate-soy-desserts	Vegetariano, Sin gluten, Sin OMG, Vegano	en:vegetarian,en:no-gluten,en:no-gmos,en:vegan	España	en:spain	Carrefour	carrefour	0					Parets del Vallés,Barcelona (provincia),Cataluña,España	parets-del-valles,barcelona-provincia,cataluna,espana	ES 26.02159/B EC,DANONE S.A.,GROUPE DANONE S.A.	es-26-02159-b-ec,danone-s-a,groupe-danone-s-a				Bebida de _soja_ 78,5 % (agua, habas de _soja_ 13,7%), azúcar, espesantes: fosfato de dialmidón hidroxipropilado (E-1442) y goma xantana (E-415), cacao desgrasado (2,1%), chocolate (2,0%) (cacao en polvo, pasta de cacao y azúcar), fosfato tricálcico (E-341iii), emulgente: glicéridos de ácidos grasos (E-471), sal y vitamina B12.						Soja	en:soybeans				100g	serving	492	kJ			3	g	1	g	17.6	g	15.2	g	1.1	g	3.5	g	0.127	g	0.0508	g			492	kJ	0.7	g	1.2	g					2.2	g							0.38	µg	120	mg								en:terrine-pot	en:plastic			en:box							https://www.alimentasonrisas.es/es/savia	en:sweets	en:sugary-snacks,en:sweets	4	en:4-ultra-processed-food-and-drink-products	b	1	b	76		20911	-5	-15	1	0	
8410500010638	es					Natillas de chocolate sin gluten		Danet chocolate x8								1000 g (125 g x8)		Plástico	en:plastic	Danone	danone	Lácteos, Postres, Postres lácteos, Postres de chocolate, Postres de cremas, Natillas chocolate, en:Refrigerated creamy puddings, en:Refrigerated chocolate creamy puddings	en:dairies,en:desserts,en:dairy-desserts,en:chocolate-desserts,en:creamy-puddings,en:chocolate-creamy-puddings,en:refrigerated-creamy-puddings,en:refrigerated-chocolate-creamy-puddings			Francia, España	en:france,en:spain			0																							100g	100g			121	kcal	3	g	1.8	g	19.9	g	17.5	g			3.2	g	0.13	g	0.052	g			121	kcal																													en:plastic											en:dairy-desserts	en:milk-and-dairy-products,en:dairy-desserts		unknown	c	4	b	68		39200	-5	-10	1	0	App - yuka, Apps
